smartctl 7.4 2023-08-01 r5530 [x86_64-linux-6.12.0-55.12.1.el10_0.x86_64] (local build)
Copyright (C) 2002-23, Bruce Allen, Christian Franke, www.smartmontools.org

=== START OF INFORMATION SECTION ===
Model Number:                       INTEL SSDPF2NV153TZ
Serial Number:                      
Firmware Version:                   ACV10370
PCI Vendor/Subsystem ID:            0x8086
IEEE OUI Identifier:                0x5cd2e4
Total NVM Capacity:                 15,362,991,415,296 [15.3 TB]
Unallocated NVM Capacity:           0
Controller ID:                      0
NVMe Version:                       1.4
Number of Namespaces:               128
Namespace 1 Size/Capacity:          15,362,991,415,296 [15.3 TB]
Namespace 1 Formatted LBA Size:     512
Namespace 1 IEEE EUI-64:            
Local Time is:                      Mon Mar  9 12:36:05 2026 KST
Firmware Updates (0x18):            4 Slots, no Reset required
Optional Admin Commands (0x001e):   Format Frmw_DL NS_Mngmt Self_Test
Optional NVM Commands (0x005e):     Wr_Unc DS_Mngmt Wr_Zero Sav/Sel_Feat Timestmp
Log Page Attributes (0x3e):         Cmd_Eff_Lg Ext_Get_Lg Telmtry_Lg Pers_Ev_Lg Log0_FISE_MI
Maximum Data Transfer Size:         32 Pages
Warning  Comp. Temp. Threshold:     70 Celsius
Critical Comp. Temp. Threshold:     80 Celsius
Namespace 1 Features (0x10):        NP_Fields

Supported Power States
St Op     Max   Active     Idle   RL RT WL WT  Ent_Lat  Ex_Lat
 0 +    25.00W   25.00W       -    0  0  0  0    60000   60000
 1 +    20.00W   20.00W       -    0  0  0  0    60000   60000
 2 +    15.00W   15.00W       -    0  0  0  0    60000   60000

Supported LBA Sizes (NSID 0x1)
Id Fmt  Data  Metadt  Rel_Perf
 0 +     512       0         2
 1 -    4096       0         2

=== START OF SMART DATA SECTION ===
SMART overall-health self-assessment test result: PASSED

SMART/Health Information (NVMe Log 0x02)
Critical Warning:                   0x00
Temperature:                        23 Celsius
Available Spare:                    99%
Available Spare Threshold:          10%
Percentage Used:                    2%
Data Units Read:                    1,492,490,216 [764 TB]
Data Units Written:                 1,314,510,976 [673 TB]
Host Read Commands:                 57,857,405,983
Host Write Commands:                14,126,115,285
Controller Busy Time:               854
Power Cycles:                       706
Power On Hours:                     9,871
Unsafe Shutdowns:                   561
Media and Data Integrity Errors:    0
Error Information Log Entries:      0
Warning  Comp. Temperature Time:    94
Critical Comp. Temperature Time:    0

Error Information (NVMe Log 0x01, 16 of 64 entries)
No Errors Logged

Self-test Log (NVMe Log 0x06)
Self-test status: No self-test in progress
No Self-tests Logged
