smartctl 7.4 2023-08-01 r5530 [x86_64-linux-6.12.0-55.20.1.el10_0.x86_64] (local build)
Copyright (C) 2002-23, Bruce Allen, Christian Franke, www.smartmontools.org

=== START OF INFORMATION SECTION ===
Model Number:                       INTEL MEMPEK1W032GA
Serial Number:                      
Firmware Version:                   K3110310
PCI Vendor/Subsystem ID:            0x8086
IEEE OUI Identifier:                0x5cd2e4
Controller ID:                      0
NVMe Version:                       <1.2
Number of Namespaces:               1
Namespace 1 Size/Capacity:          29,260,513,280 [29.2 GB]
Namespace 1 Formatted LBA Size:     512
Local Time is:                      Mon Aug 25 12:52:17 2025 KST
Firmware Updates (0x02):            1 Slot
Optional Admin Commands (0x0006):   Format Frmw_DL
Optional NVM Commands (0x0046):     Wr_Unc DS_Mngmt Timestmp
Log Page Attributes (0x02):         Cmd_Eff_Lg
Maximum Data Transfer Size:         32 Pages

Supported Power States
St Op     Max   Active     Idle   RL RT WL WT  Ent_Lat  Ex_Lat
 0 +     4.50W       -        -    0  0  0  0        0       0

Supported LBA Sizes (NSID 0x1)
Id Fmt  Data  Metadt  Rel_Perf
 0 +     512       0         2

=== START OF SMART DATA SECTION ===
SMART overall-health self-assessment test result: PASSED

SMART/Health Information (NVMe Log 0x02)
Critical Warning:                   0x00
Temperature:                        35 Celsius
Available Spare:                    100%
Available Spare Threshold:          0%
Percentage Used:                    4%
Data Units Read:                    64,336,571 [32.9 TB]
Data Units Written:                 16,714,121 [8.55 TB]
Host Read Commands:                 3,731,042,262
Host Write Commands:                747,655,859
Controller Busy Time:               0
Power Cycles:                       1,458
Power On Hours:                     7,141
Unsafe Shutdowns:                   569
Media and Data Integrity Errors:    0
Error Information Log Entries:      0

Error Information (NVMe Log 0x01, 16 of 64 entries)
No Errors Logged

Self-tests not supported

