smartctl 7.4 2023-08-01 r5530 [x86_64-linux-6.12.0-55.12.1.el10_0.x86_64] (local build)
Copyright (C) 2002-23, Bruce Allen, Christian Franke, www.smartmontools.org

=== START OF INFORMATION SECTION ===
Model Number:                       INTEL SSDPEK1W120GA
Serial Number:                      
Firmware Version:                   K4110440
PCI Vendor/Subsystem ID:            0x8086
IEEE OUI Identifier:                0x5cd2e4
Controller ID:                      0
NVMe Version:                       <1.2
Number of Namespaces:               1
Namespace 1 Size/Capacity:          118,410,444,800 [118 GB]
Namespace 1 Formatted LBA Size:     512
Namespace 1 IEEE EUI-64:            5cd2e4 909d140100
Local Time is:                      Sun Nov 23 21:17:36 2025 KST
Firmware Updates (0x02):            1 Slot
Optional Admin Commands (0x0006):   Format Frmw_DL
Optional NVM Commands (0x0046):     Wr_Unc DS_Mngmt Timestmp
Log Page Attributes (0x02):         Cmd_Eff_Lg
Maximum Data Transfer Size:         32 Pages

Supported Power States
St Op     Max   Active     Idle   RL RT WL WT  Ent_Lat  Ex_Lat
 0 +     3.60W       -        -    0  0  0  0  1000000   50000
 1 +     2.50W       -        -    0  1  0  1  1000000   50000
 2 +     1.80W       -        -    0  2  0  2  1000000   50000
 3 -   0.0080W       -        -    0  0  0  0  1150000   50000

Supported LBA Sizes (NSID 0x1)
Id Fmt  Data  Metadt  Rel_Perf
 0 +     512       0         2

=== START OF SMART DATA SECTION ===
SMART overall-health self-assessment test result: PASSED

SMART/Health Information (NVMe Log 0x02)
Critical Warning:                   0x00
Temperature:                        36 Celsius
Available Spare:                    100%
Available Spare Threshold:          0%
Percentage Used:                    1%
Data Units Read:                    14,105,421 [7.22 TB]
Data Units Written:                 12,288,387 [6.29 TB]
Host Read Commands:                 191,998,020
Host Write Commands:                116,562,444
Controller Busy Time:               0
Power Cycles:                       1,530
Power On Hours:                     7,806
Unsafe Shutdowns:                   81
Media and Data Integrity Errors:    0
Error Information Log Entries:      0

Error Information (NVMe Log 0x01, 16 of 64 entries)
No Errors Logged

Self-tests not supported

