smartctl 7.4 2023-08-01 r5530 [x86_64-linux-6.12.0-55.20.1.el10_0.x86_64] (local build)
Copyright (C) 2002-23, Bruce Allen, Christian Franke, www.smartmontools.org

=== START OF INFORMATION SECTION ===
Model Number:                       INTEL SSDPEK1A118GA
Serial Number:                      
Firmware Version:                   U5110550
PCI Vendor/Subsystem ID:            0x8086
IEEE OUI Identifier:                0x5cd2e4
Controller ID:                      0
NVMe Version:                       1.1
Number of Namespaces:               1
Namespace 1 Size/Capacity:          118,410,444,800 [118 GB]
Namespace 1 Formatted LBA Size:     4096
Namespace 1 IEEE EUI-64:            5cd2e4 d07c210100
Local Time is:                      Wed Aug 27 07:16:31 2025 KST
Firmware Updates (0x02):            1 Slot
Optional Admin Commands (0x0016):   Format Frmw_DL Self_Test
Optional NVM Commands (0x0056):     Wr_Unc DS_Mngmt Sav/Sel_Feat Timestmp
Log Page Attributes (0x03):         S/H_per_NS Cmd_Eff_Lg
Maximum Data Transfer Size:         32 Pages
Warning  Comp. Temp. Threshold:     70 Celsius
Critical Comp. Temp. Threshold:     78 Celsius

Supported Power States
St Op     Max   Active     Idle   RL RT WL WT  Ent_Lat  Ex_Lat
 0 +     5.50W       -        -    0  0  0  0     1000    4000
 1 +     4.60W       -        -    0  1  0  1     1000    4000
 2 +     3.30W       -        -    0  2  0  2     1000    4000

Supported LBA Sizes (NSID 0x1)
Id Fmt  Data  Metadt  Rel_Perf
 0 -     512       0         2
 1 +    4096       0         0

=== START OF SMART DATA SECTION ===
SMART overall-health self-assessment test result: PASSED

SMART/Health Information (NVMe Log 0x02)
Critical Warning:                   0x00
Temperature:                        33 Celsius
Available Spare:                    100%
Available Spare Threshold:          0%
Percentage Used:                    0%
Data Units Read:                    3,512,688 [1.79 TB]
Data Units Written:                 15,642,654 [8.00 TB]
Host Read Commands:                 134,345,451
Host Write Commands:                127,941,433
Controller Busy Time:               375
Power Cycles:                       121
Power On Hours:                     6,037
Unsafe Shutdowns:                   32
Media and Data Integrity Errors:    0
Error Information Log Entries:      0
Warning  Comp. Temperature Time:    0
Critical Comp. Temperature Time:    0

Error Information (NVMe Log 0x01, 16 of 64 entries)
No Errors Logged

Read Self-test Log failed: Invalid Field in Command (0x4002)