smartctl 7.4 2023-08-01 r5530 [x86_64-linux-6.12.0-55.20.1.el10_0.x86_64] (local build)
Copyright (C) 2002-23, Bruce Allen, Christian Franke, www.smartmontools.org

=== START OF INFORMATION SECTION ===
Model Number:                       Micron_7300_MTFDHBE3T2TDG
Serial Number:                      
Firmware Version:                   95420100
PCI Vendor/Subsystem ID:            0x1344
IEEE OUI Identifier:                0x00a075
Total NVM Capacity:                 3,200,631,791,616 [3.20 TB]
Unallocated NVM Capacity:           0
Controller ID:                      1
NVMe Version:                       1.3
Number of Namespaces:               1
Namespace 1 Size/Capacity:          3,200,623,050,752 [3.20 TB]
Namespace 1 Formatted LBA Size:     512
Namespace 1 IEEE EUI-64:            00a075 032cbe131a
Local Time is:                      Fri Oct 17 16:36:49 2025 KST
Firmware Updates (0x17):            3 Slots, Slot 1 R/O, no Reset required
Optional Admin Commands (0x001e):   Format Frmw_DL NS_Mngmt Self_Test
Optional NVM Commands (0x0034):     DS_Mngmt Sav/Sel_Feat Resv
Log Page Attributes (0x02):         Cmd_Eff_Lg
Maximum Data Transfer Size:         32 Pages
Warning  Comp. Temp. Threshold:     72 Celsius
Critical Comp. Temp. Threshold:     75 Celsius
Namespace 1 Features (0x08):        No_ID_Reuse

Supported Power States
St Op     Max   Active     Idle   RL RT WL WT  Ent_Lat  Ex_Lat
 0 +    12.00W       -        -    0  0  0  0        0       0
 1 +    11.00W       -        -    1  1  1  1        0       0
 2 +    10.00W       -        -    2  2  2  2        0       0
 3 +     9.00W       -        -    3  3  3  3        0       0
 4 +     8.00W       -        -    4  4  4  4        0       0
 5 +     7.00W       -        -    5  5  5  5        0       0
 6 +     6.00W       -        -    6  6  6  6        0       0
 7 +     5.00W       -        -    7  7  7  7        0       0

Supported LBA Sizes (NSID 0x1)
Id Fmt  Data  Metadt  Rel_Perf
 0 +     512       0         0
 1 -    4096       0         0
 2 -     512       8         0
 3 -    4096       8         0
 4 -    4096      64         0

=== START OF SMART DATA SECTION ===
SMART overall-health self-assessment test result: PASSED

SMART/Health Information (NVMe Log 0x02)
Critical Warning:                   0x00
Temperature:                        40 Celsius
Available Spare:                    100%
Available Spare Threshold:          5%
Percentage Used:                    2%
Data Units Read:                    1,394,467,884 [713 TB]
Data Units Written:                 1,778,474,912 [910 TB]
Host Read Commands:                 10,901,940,725
Host Write Commands:                17,533,285,362
Controller Busy Time:               83,140
Power Cycles:                       579
Power On Hours:                     4,302
Unsafe Shutdowns:                   19
Media and Data Integrity Errors:    0
Error Information Log Entries:      1
Warning  Comp. Temperature Time:    47
Critical Comp. Temperature Time:    0
Temperature Sensor 1:               57 Celsius
Temperature Sensor 2:               34 Celsius

Error Information (NVMe Log 0x01, 16 of 63 entries)
Num   ErrCount  SQId   CmdId  Status  PELoc          LBA  NSID    VS  Message
  0          1     0  0x0000  0x1001  0x02a            -     0     -  Successful Completion

Read Self-test Log failed: Invalid Field in Command (0x2002)

