smartctl 7.4 2023-08-01 r5530 [x86_64-linux-6.12.0-55.12.1.el10_0.x86_64] (local build)
Copyright (C) 2002-23, Bruce Allen, Christian Franke, www.smartmontools.org

=== START OF INFORMATION SECTION ===
Model Number:                       KFL6XHUL1T60
Serial Number:                      
Firmware Version:                   0103
PCI Vendor/Subsystem ID:            0x1e0f
IEEE OUI Identifier:                0x8ce38e
Total NVM Capacity:                 1,600,321,314,816 [1.60 TB]
Unallocated NVM Capacity:           0
Controller ID:                      1
NVMe Version:                       1.4
Number of Namespaces:               64
Namespace 1 Size/Capacity:          1,600,321,314,816 [1.60 TB]
Namespace 1 Utilization:            0
Namespace 1 Formatted LBA Size:     512
Namespace 1 IEEE EUI-64:            8ce38e e210e53b01
Local Time is:                      Fri Nov 14 21:32:57 2025 KST
Firmware Updates (0x16):            3 Slots, no Reset required
Optional Admin Commands (0x025f):   Security Format Frmw_DL NS_Mngmt Self_Test MI_Snd/Rec Get_LBA_Sts
Optional NVM Commands (0x00ff):     Comp Wr_Unc DS_Mngmt Wr_Zero Sav/Sel_Feat Resv Timestmp Verify
Log Page Attributes (0x1e):         Cmd_Eff_Lg Ext_Get_Lg Telmtry_Lg Pers_Ev_Lg
Maximum Data Transfer Size:         8192 Pages
Warning  Comp. Temp. Threshold:     77 Celsius
Critical Comp. Temp. Threshold:     82 Celsius
Namespace 1 Features (0x14):        Dea/Unw_Error NP_Fields

Supported Power States
St Op     Max   Active     Idle   RL RT WL WT  Ent_Lat  Ex_Lat
 0 +    27.50W   25.00W       -    0  0  0  0   500000  500000
 1 +    19.80W   18.00W       -    1  1  1  1   500000  500000
 2 +    15.40W   14.00W       -    2  2  2  2   500000  500000
 3 +    12.10W   11.00W       -    3  3  3  3   500000  500000
 4 -     5.00W       -        -    4  4  4  4   500000  500000

Supported LBA Sizes (NSID 0x1)
Id Fmt  Data  Metadt  Rel_Perf
 0 +     512       0         0
 1 -     512       8         0
 2 -       1       0         0
 3 -    4096       0         0
 4 -    4096       8         0
 5 -    4096      64         0

=== START OF SMART DATA SECTION ===
SMART overall-health self-assessment test result: PASSED

SMART/Health Information (NVMe Log 0x02)
Critical Warning:                   0x00
Temperature:                        36 Celsius
Available Spare:                    100%
Available Spare Threshold:          13%
Percentage Used:                    0%
Data Units Read:                    18,808,720 [9.63 TB]
Data Units Written:                 87,145,492 [44.6 TB]
Host Read Commands:                 1,197,604,470
Host Write Commands:                192,448,265
Controller Busy Time:               235
Power Cycles:                       1,357
Power On Hours:                     8,014
Unsafe Shutdowns:                   232
Media and Data Integrity Errors:    0
Error Information Log Entries:      20
Warning  Comp. Temperature Time:    0
Critical Comp. Temperature Time:    0

Error Information (NVMe Log 0x01, 16 of 256 entries)
No Errors Logged

Self-test Log (NVMe Log 0x06)
Self-test status: No self-test in progress
No Self-tests Logged

