smartctl 7.4 2023-08-01 r5530 [x86_64-linux-6.12.0-55.20.1.el10_0.x86_64] (local build)
Copyright (C) 2002-23, Bruce Allen, Christian Franke, www.smartmontools.org

=== START OF INFORMATION SECTION ===
Model Number:                       SAMSUNG MZVLC1T0HFLU-00BL2
Serial Number:                      
Firmware Version:                   4L1QNXH7
PCI Vendor/Subsystem ID:            0x144d
IEEE OUI Identifier:                0x002538
Total NVM Capacity:                 1,024,209,543,168 [1.02 TB]
Unallocated NVM Capacity:           0
Controller ID:                      1
NVMe Version:                       2.0
Number of Namespaces:               1
Namespace 1 Size/Capacity:          1,024,209,543,168 [1.02 TB]
Namespace 1 Utilization:            687,943,680 [687 MB]
Namespace 1 Formatted LBA Size:     512
Namespace 1 IEEE EUI-64:            002538 c251b03173
Local Time is:                      Sun Jul 20 14:19:13 2025 KST
Firmware Updates (0x16):            3 Slots, no Reset required
Optional Admin Commands (0x0057):   Security Format Frmw_DL Self_Test MI_Snd/Rec
Optional NVM Commands (0x00df):     Comp Wr_Unc DS_Mngmt Wr_Zero Sav/Sel_Feat Timestmp Verify
Log Page Attributes (0x7f):         S/H_per_NS Cmd_Eff_Lg Ext_Get_Lg Telmtry_Lg Pers_Ev_Lg Log0_FISE_MI Telmtry_Ar_4
Maximum Data Transfer Size:         128 Pages
Warning  Comp. Temp. Threshold:     83 Celsius
Critical Comp. Temp. Threshold:     85 Celsius

Supported Power States
St Op     Max   Active     Idle   RL RT WL WT  Ent_Lat  Ex_Lat
 0 +     8.92W       -        -    0  0  0  0     1000    1000
 1 +     8.92W       -        -    1  1  1  1     1000    1000
 2 +     8.92W       -        -    2  2  2  2     1000    1000
 3 -   0.0100W       -        -    3  3  3  3     4000   11000
 4 -   0.0050W       -        -    4  4  4  4     4000   46000

Supported LBA Sizes (NSID 0x1)
Id Fmt  Data  Metadt  Rel_Perf
 0 +     512       0         0

=== START OF SMART DATA SECTION ===
SMART overall-health self-assessment test result: PASSED

SMART/Health Information (NVMe Log 0x02)
Critical Warning:                   0x00
Temperature:                        28 Celsius
Available Spare:                    100%
Available Spare Threshold:          10%
Percentage Used:                    0%
Data Units Read:                    1,697,067 [868 GB]
Data Units Written:                 1,867,843 [956 GB]
Host Read Commands:                 5,071,750
Host Write Commands:                3,239,678
Controller Busy Time:               15
Power Cycles:                       29
Power On Hours:                     4
Unsafe Shutdowns:                   10
Media and Data Integrity Errors:    0
Error Information Log Entries:      0
Warning  Comp. Temperature Time:    0
Critical Comp. Temperature Time:    0
Temperature Sensor 1:               38 Celsius
Temperature Sensor 2:               28 Celsius

Error Information (NVMe Log 0x01, 16 of 64 entries)
No Errors Logged

Read Self-test Log failed: Invalid Field in Command (0x002)