smartctl 7.4 2023-08-01 r5530 [x86_64-linux-6.12.0-55.12.1.el10_0.x86_64] (local build)
Copyright (C) 2002-23, Bruce Allen, Christian Franke, www.smartmontools.org

=== START OF INFORMATION SECTION ===
Model Family:     Crucial/Micron Client SSDs
Device Model:     Micron_1300_MTFDDAK1T0TDL
Serial Number:    
LU WWN Device Id: 5 00a075 128bdf34a
Firmware Version: M5MU030
User Capacity:    1,024,209,543,168 bytes [1.02 TB]
Sector Size:      512 bytes logical/physical
Rotation Rate:    Solid State Device
Form Factor:      2.5 inches
TRIM Command:     Available, deterministic, zeroed
Device is:        In smartctl database 7.3/5610
ATA Version is:   ACS-4 T13/BSR INCITS 529 revision 5
SATA Version is:  SATA 3.3, 6.0 Gb/s (current: 6.0 Gb/s)
Local Time is:    Sat Nov 22 23:59:34 2025 KST
SMART support is: Available - device has SMART capability.
SMART support is: Enabled

=== START OF READ SMART DATA SECTION ===
SMART overall-health self-assessment test result: PASSED

General SMART Values:
Offline data collection status:  (0x00)	Offline data collection activity
					was never started.
					Auto Offline Data Collection: Disabled.
Self-test execution status:      (   0)	The previous self-test routine completed
					without error or no self-test has ever 
					been run.
Total time to complete Offline 
data collection: 		( 2714) seconds.
Offline data collection
capabilities: 			 (0x7b) SMART execute Offline immediate.
					Auto Offline data collection on/off support.
					Suspend Offline collection upon new
					command.
					Offline surface scan supported.
					Self-test supported.
					Conveyance Self-test supported.
					Selective Self-test supported.
SMART capabilities:            (0x0003)	Saves SMART data before entering
					power-saving mode.
					Supports SMART auto save timer.
Error logging capability:        (0x01)	Error logging supported.
					General Purpose Logging supported.
Short self-test routine 
recommended polling time: 	 (   2) minutes.
Extended self-test routine
recommended polling time: 	 (  13) minutes.
Conveyance self-test routine
recommended polling time: 	 (   3) minutes.
SCT capabilities: 	       (0x0035)	SCT Status supported.
					SCT Feature Control supported.
					SCT Data Table supported.

SMART Attributes Data Structure revision number: 16
Vendor Specific SMART Attributes with Thresholds:
ID# ATTRIBUTE_NAME          FLAG     VALUE WORST THRESH TYPE      UPDATED  WHEN_FAILED RAW_VALUE
  1 Raw_Read_Error_Rate     0x002f   100   100   000    Pre-fail  Always       -       0
  5 Reallocate_NAND_Blk_Cnt 0x0032   100   100   010    Old_age   Always       -       0
  9 Power_On_Hours          0x0032   100   100   000    Old_age   Always       -       20200
 12 Power_Cycle_Count       0x0032   100   100   000    Old_age   Always       -       268
171 Program_Fail_Count      0x0032   100   100   000    Old_age   Always       -       0
172 Erase_Fail_Count        0x0032   100   100   000    Old_age   Always       -       0
173 Ave_Block-Erase_Count   0x0032   092   092   000    Old_age   Always       -       99
174 Unexpect_Power_Loss_Ct  0x0032   100   100   000    Old_age   Always       -       182
183 SATA_Interfac_Downshift 0x0032   100   100   000    Old_age   Always       -       0
184 Error_Correction_Count  0x0032   100   100   000    Old_age   Always       -       0
187 Reported_Uncorrect      0x0032   100   100   000    Old_age   Always       -       0
194 Temperature_Celsius     0x0022   069   045   000    Old_age   Always       -       31 (Min/Max 20/55)
196 Reallocated_Event_Count 0x0032   100   100   000    Old_age   Always       -       0
197 Current_Pending_ECC_Cnt 0x0032   100   100   000    Old_age   Always       -       0
198 Offline_Uncorrectable   0x0030   100   100   000    Old_age   Offline      -       0
199 UDMA_CRC_Error_Count    0x0032   100   100   000    Old_age   Always       -       1
202 Percent_Lifetime_Remain 0x0030   092   092   001    Old_age   Offline      -       8
206 Write_Error_Rate        0x000e   100   100   000    Old_age   Always       -       0
246 Total_LBAs_Written      0x0032   100   100   000    Old_age   Always       -       63564144000
247 Host_Program_Page_Count 0x0032   100   100   000    Old_age   Always       -       1994977255
248 FTL_Program_Page_Count  0x0032   100   100   000    Old_age   Always       -       2445655969
180 Unused_Reserve_NAND_Blk 0x0033   000   000   000    Pre-fail  Always       -       1907
210 Success_RAIN_Recov_Cnt  0x0032   100   100   000    Old_age   Always       -       0

SMART Error Log Version: 1
No Errors Logged

SMART Self-test log structure revision number 1
Num  Test_Description    Status                  Remaining  LifeTime(hours)  LBA_of_first_error
# 1  Vendor (0xff)       Completed without error       00%     20162         -
# 2  Short offline       Completed without error       00%     20057         -
# 3  Vendor (0xff)       Completed without error       00%     20046         -
# 4  Vendor (0xff)       Completed without error       00%     19997         -
# 5  Vendor (0xff)       Completed without error       00%     19909         -
# 6  Short offline       Completed without error       00%     19891         -
# 7  Vendor (0xff)       Completed without error       00%     19841         -
# 8  Extended offline    Completed without error       00%     19748         -
# 9  Short offline       Completed without error       00%     19724         -
#10  Vendor (0xff)       Completed without error       00%     19715         -
#11  Short offline       Completed without error       00%     19556         -
#12  Vendor (0xff)       Completed without error       00%     19542         -
#13  Short offline       Completed without error       00%     19388         -
#14  Vendor (0xff)       Completed without error       00%     19387         -
#15  Short offline       Completed without error       00%     19220         -
#16  Vendor (0xff)       Completed without error       00%     19219         -
#17  Short offline       Completed without error       00%     19052         -
#18  Extended offline    Completed without error       00%     19029         -
#19  Vendor (0xff)       Completed without error       00%     19016         -
#20  Short offline       Completed without error       00%     18884         -
#21  Vendor (0xff)       Completed without error       00%     18884         -

SMART Selective self-test log data structure revision number 1
 SPAN  MIN_LBA  MAX_LBA  CURRENT_TEST_STATUS
    1        0        0  Not_testing
    2        0        0  Not_testing
    3        0        0  Not_testing
    4        0        0  Not_testing
    5        0        0  Not_testing
Selective self-test flags (0x0):
  After scanning selected spans, do NOT read-scan remainder of disk.
If Selective self-test is pending on power-up, resume after 0 minute delay.

The above only provides legacy SMART information - try 'smartctl -x' for more

