smartctl 7.4 2023-08-01 r5530 [x86_64-linux-6.12.0-55.12.1.el10_0.x86_64] (local build)
Copyright (C) 2002-23, Bruce Allen, Christian Franke, www.smartmontools.org

=== START OF INFORMATION SECTION ===
Model Family:     OCZ/Toshiba Trion SSDs
Device Model:     TOSHIBA Q300 Pro.
Serial Number:    
LU WWN Device Id: 5 00080d 910762d89
Firmware Version: JYRA0101
User Capacity:    256,060,514,304 bytes [256 GB]
Sector Size:      512 bytes logical/physical
Rotation Rate:    Solid State Device
Form Factor:      2.5 inches
TRIM Command:     Available, deterministic, zeroed
Device is:        In smartctl database 7.3/5610
ATA Version is:   ACS-2 (minor revision not indicated)
SATA Version is:  SATA 3.1, 6.0 Gb/s (current: 6.0 Gb/s)
Local Time is:    Wed Apr  1 12:55:38 2026 KST
SMART support is: Available - device has SMART capability.
SMART support is: Enabled

=== START OF READ SMART DATA SECTION ===
SMART overall-health self-assessment test result: PASSED

General SMART Values:
Offline data collection status:  (0x00)	Offline data collection activity
					was never started.
					Auto Offline Data Collection: Disabled.
Self-test execution status:      (   0)	The previous self-test routine completed
					without error or no self-test has ever 
					been run.
Total time to complete Offline 
data collection: 		(  120) seconds.
Offline data collection
capabilities: 			 (0x5b) SMART execute Offline immediate.
					Auto Offline data collection on/off support.
					Suspend Offline collection upon new
					command.
					Offline surface scan supported.
					Self-test supported.
					No Conveyance Self-test supported.
					Selective Self-test supported.
SMART capabilities:            (0x0003)	Saves SMART data before entering
					power-saving mode.
					Supports SMART auto save timer.
Error logging capability:        (0x01)	Error logging supported.
					General Purpose Logging supported.
Short self-test routine 
recommended polling time: 	 (   2) minutes.
Extended self-test routine
recommended polling time: 	 (  10) minutes.
SCT capabilities: 	       (0x003d)	SCT Status supported.
					SCT Error Recovery Control supported.
					SCT Feature Control supported.
					SCT Data Table supported.

SMART Attributes Data Structure revision number: 16
Vendor Specific SMART Attributes with Thresholds:
ID# ATTRIBUTE_NAME          FLAG     VALUE WORST THRESH TYPE      UPDATED  WHEN_FAILED RAW_VALUE
  1 Raw_Read_Error_Rate     0x000a   100   100   000    Old_age   Always       -       0
  2 Throughput_Performance  0x0005   100   100   050    Pre-fail  Offline      -       0
  3 Spin_Up_Time            0x0007   100   100   050    Pre-fail  Always       -       0
  5 Reallocated_Sector_Ct   0x0013   100   100   050    Pre-fail  Always       -       0
  7 Unknown_SSD_Attribute   0x000b   100   100   050    Pre-fail  Always       -       0
  8 Unknown_SSD_Attribute   0x0005   100   100   050    Pre-fail  Offline      -       0
  9 Power_On_Hours          0x0012   100   100   000    Old_age   Always       -       70513
 10 Unknown_SSD_Attribute   0x0013   100   100   050    Pre-fail  Always       -       0
 12 Power_Cycle_Count       0x0012   100   100   000    Old_age   Always       -       22
167 SSD_Protect_Mode        0x0022   100   100   000    Old_age   Always       -       0
168 SATA_PHY_Error_Count    0x0012   100   100   000    Old_age   Always       -       0
169 Bad_Block_Count         0x0013   100   100   010    Pre-fail  Always       -       100
173 Erase_Count             0x0012   148   148   000    Old_age   Always       -       0
175 Program_Fail_Count_Chip 0x0013   100   100   010    Pre-fail  Always       -       0
192 Unexpect_Power_Loss_Ct  0x0012   100   100   000    Old_age   Always       -       19
194 Temperature_Celsius     0x0023   078   065   020    Pre-fail  Always       -       22 (Min/Max 15/35)
197 Current_Pending_Sector  0x0012   100   100   000    Old_age   Always       -       0
240 Unknown_SSD_Attribute   0x0013   100   100   050    Pre-fail  Always       -       0

SMART Error Log Version: 1
No Errors Logged

SMART Self-test log structure revision number 1
No self-tests have been logged.  [To run self-tests, use: smartctl -t]

SMART Selective self-test log data structure revision number 1
 SPAN  MIN_LBA  MAX_LBA  CURRENT_TEST_STATUS
    1        0        0  Not_testing
    2        0        0  Not_testing
    3        0        0  Not_testing
    4        0        0  Not_testing
    5        0        0  Not_testing
Selective self-test flags (0x0):
  After scanning selected spans, do NOT read-scan remainder of disk.
If Selective self-test is pending on power-up, resume after 0 minute delay.

The above only provides legacy SMART information - try 'smartctl -x' for more

