smartctl 7.4 2023-08-01 r5530 [x86_64-linux-6.12.0-55.12.1.el10_0.x86_64] (local build)
Copyright (C) 2002-23, Bruce Allen, Christian Franke, www.smartmontools.org

=== START OF INFORMATION SECTION ===
Model Number:                       WDC PC SN520 SDAPMUW-128G-1001
Serial Number:                      
Firmware Version:                   20260001
PCI Vendor/Subsystem ID:            0x15b7
IEEE OUI Identifier:                0x001b44
Total NVM Capacity:                 128,035,676,160 [128 GB]
Unallocated NVM Capacity:           0
Controller ID:                      1
NVMe Version:                       1.3
Number of Namespaces:               1
Namespace 1 Size/Capacity:          128,035,676,160 [128 GB]
Namespace 1 Formatted LBA Size:     512
Namespace 1 IEEE EUI-64:            001b44 8b46bca20f
Local Time is:                      Sun Jul 13 21:24:18 2025 KST
Firmware Updates (0x14):            2 Slots, no Reset required
Optional Admin Commands (0x0017):   Security Format Frmw_DL Self_Test
Optional NVM Commands (0x001f):     Comp Wr_Unc DS_Mngmt Wr_Zero Sav/Sel_Feat
Log Page Attributes (0x02):         Cmd_Eff_Lg
Maximum Data Transfer Size:         128 Pages
Warning  Comp. Temp. Threshold:     82 Celsius
Critical Comp. Temp. Threshold:     86 Celsius
Namespace 1 Features (0x02):        NA_Fields

Supported Power States
St Op     Max   Active     Idle   RL RT WL WT  Ent_Lat  Ex_Lat
 0 +     2.50W       -        -    0  0  0  0        0       0
 1 +     2.50W       -        -    1  1  1  1        0       0
 2 +     1.70W       -        -    2  2  2  2        0       0
 3 -   0.0250W       -        -    3  3  3  3     5000    9000
 4 -   0.0025W       -        -    4  4  4  4     5000   44000

Supported LBA Sizes (NSID 0x1)
Id Fmt  Data  Metadt  Rel_Perf
 0 +     512       0         2
 1 -    4096       0         1

=== START OF SMART DATA SECTION ===
SMART overall-health self-assessment test result: PASSED

SMART/Health Information (NVMe Log 0x02)
Critical Warning:                   0x00
Temperature:                        36 Celsius
Available Spare:                    100%
Available Spare Threshold:          10%
Percentage Used:                    1%
Data Units Read:                    2,732,271 [1.39 TB]
Data Units Written:                 6,108,067 [3.12 TB]
Host Read Commands:                 52,838,196
Host Write Commands:                71,141,935
Controller Busy Time:               329
Power Cycles:                       501
Power On Hours:                     531
Unsafe Shutdowns:                   113
Media and Data Integrity Errors:    0
Error Information Log Entries:      0
Warning  Comp. Temperature Time:    6
Critical Comp. Temperature Time:    3
Thermal Temp. 1 Transition Count:   14
Thermal Temp. 2 Transition Count:   5
Thermal Temp. 1 Total Time:         539
Thermal Temp. 2 Total Time:         139

Error Information (NVMe Log 0x01, 16 of 256 entries)
No Errors Logged

Read Self-test Log failed: Invalid Field in Command (0x4002)