NVME Identify Controller:
vid       : 0x10ec
ssvid     : 0x10ec
sn        : 
mn        : KLEVV CRAS C910 M.2 NVMe SSD 4TB        
fr        : VF101C59
rab       : 5
ieee      : 00e04c
cmic      : 0
  [3:3] : 0	ANA not supported
  [2:2] : 0	PCI
  [1:1] : 0	Single Controller
  [0:0] : 0	Single Port

mdts      : 6
cntlid    : 0x1
ver       : 0x10400
rtd3r     : 0x7a120
rtd3e     : 0x1e8480
oaes      : 0x200
  [31:31] : 0	Discovery Log Change Notice Not Supported
  [27:27] : 0	Zone Descriptor Changed Notices Not Supported
  [16:16] : 0	Temperature Threshold Hysteresis Recovery Not Supported
  [15:15] : 0	Normal NSS Shutdown Event Not Supported
  [14:14] : 0	Endurance Group Event Aggregate Log Page Change Notice Not Supported
  [13:13] : 0	LBA Status Information Notices Not Supported
  [12:12] : 0	Predictable Latency Event Aggregate Log Change Notices Not Supported
  [11:11] : 0	Asymmetric Namespace Access Change Notices Not Supported
  [9:9] : 0x1	Firmware Activation Notices Supported
  [8:8] : 0	Namespace Attribute Changed Event Not Supported

ctratt    : 0
  [19:19] : 0	Flexible Data Placement Not Supported
  [17:17] : 0	HMB Restrict Non-Operational Power State Access Not Supported
  [16:16] : 0	MDTS and Size Limits Exclude Metadata Not Supported
  [15:15] : 0	Extended LBA Formats Not Supported
  [14:14] : 0	Delete NVM Set Not Supported
  [13:13] : 0	Delete Endurance Group Not Supported
  [12:12] : 0	Variable Capacity Management Not Supported
  [11:11] : 0	Fixed Capacity Management Not Supported
  [10:10] : 0	Multi Domain Subsystem Not Supported
  [9:9] : 0	UUID List Not Supported
  [8:8] : 0	SQ Associations Not Supported
  [7:7] : 0	Namespace Granularity Not Supported
  [6:6] : 0	Traffic Based Keep Alive Not Supported
  [5:5] : 0	Predictable Latency Mode Not Supported
  [4:4] : 0	Endurance Groups Not Supported
  [3:3] : 0	Read Recovery Levels Not Supported
  [2:2] : 0	NVM Sets Not Supported
  [1:1] : 0	Non-Operational Power State Permissive Not Supported
  [0:0] : 0	128-bit Host Identifier Not Supported

rrls      : 0
cntrltype : 1
  [7:2] : 0	Reserved
  [1:0] : 0x1	I/O Controller
fguid     : 00000000-0000-0000-0000-000000000000
crdt1     : 0
crdt2     : 0
crdt3     : 0
nvmsr     : 0
  [1:1] : 0	NVM subsystem Not part of an Enclosure
  [0:0] : 0	NVM subsystem Not part of a Storage Device

vwci      : 0
  [7:7] : 0	VPD Write Cycles Remaining field is Not valid.
  [6:0] : 0	VPD Write Cycles Remaining

mec       : 0
  [1:1] : 0	NVM subsystem Not contains a Management Endpoint on a PCIe port
  [0:0] : 0	NVM subsystem Not contains a Management Endpoint on an SMBus/I2C port

oacs      : 0x17
  [10:10] : 0	Lockdown Command and Feature Not Supported
  [9:9] : 0	Get LBA Status Capability Not Supported
  [8:8] : 0	Doorbell Buffer Config Not Supported
  [7:7] : 0	Virtualization Management Not Supported
  [6:6] : 0	NVMe-MI Send and Receive Not Supported
  [5:5] : 0	Directives Not Supported
  [4:4] : 0x1	Device Self-test Supported
  [3:3] : 0	NS Management and Attachment Not Supported
  [2:2] : 0x1	FW Commit and Download Supported
  [1:1] : 0x1	Format NVM Supported
  [0:0] : 0x1	Security Send and Receive Supported

acl       : 0
aerl      : 3
frmw      : 0x2
  [5:5] : 0	Multiple FW or Boot Update Detection Not Supported
  [4:4] : 0	Firmware Activate Without Reset Not Supported
  [3:1] : 0x1	Number of Firmware Slots
  [0:0] : 0	Firmware Slot 1 Read/Write

lpa       : 0x2
  [6:6] : 0	Telemetry Log Data Area 4 Not Supported
  [5:5] : 0	LID 0x0, Scope of each command in LID 0x5, 0x12, 0x13 Not Supported
  [4:4] : 0	Persistent Event log Not Supported
  [3:3] : 0	Telemetry host/controller initiated log page Not Supported
  [2:2] : 0	Extended data for Get Log Page Not Supported
  [1:1] : 0x1	Command Effects Log Page Supported
  [0:0] : 0	SMART/Health Log Page per NS Not Supported

elpe      : 7
  [7:0] : 7 (0's based)	Error Log Page Entries (ELPE)

npss      : 4
  [7:0] : 4 (0's based)	Number of Power States Support (NPSS)

avscc     : 0x1
  [0:0] : 0x1	Admin Vendor Specific Commands uses NVMe Format

apsta     : 0x1
  [0:0] : 0x1	Autonomous Power State Transitions Supported

wctemp    : 373
 [15:0] : 212 째F (373 K)	Warning Composite Temperature Threshold (WCTEMP)

cctemp    : 383
 [15:0] : 230 째F (383 K)	Critical Composite Temperature Threshold (CCTEMP)

mtfa      : 150
hmpre     : 16384
hmmin     : 8192
tnvmcap   : 4,000,787,030,016
[127:0] : 4,000,787,030,016
	Total NVM Capacity (TNVMCAP)

unvmcap   : 0
[127:0] : 0
	Unallocated NVM Capacity (UNVMCAP)

rpmbs     : 0
 [31:24]: 0	Access Size
 [23:16]: 0	Total Size
  [5:3] : 0	Authentication Method
  [2:0] : 0	Number of RPMB Units

edstt     : 5
dsto      : 1
fwug      : 1
kas       : 1200
hctma     : 0x1
  [0:0] : 0x1	Host Controlled Thermal Management Supported

mntmt     : 333
 [15:0] : 140 째F (333 K)	Minimum Thermal Management Temperature (MNTMT)

mxtmt     : 393
 [15:0] : 248 째F (393 K)	Maximum Thermal Management Temperature (MXTMT)

sanicap   : 0xa0000002
  [31:30] : 0x2	Media is additionally modified after sanitize operation completes successfully
  [29:29] : 0x1	No-Deallocate After Sanitize bit in Sanitize command Not Supported
  [3:3] : 0	Media Verification and Post-Verification Deallocation state Not Supported
  [2:2] : 0	Overwrite Sanitize Operation Not Supported
  [1:1] : 0x1	Block Erase Sanitize Operation Supported
  [0:0] : 0	Crypto Erase Sanitize Operation Not Supported

hmminds   : 1020
hmmaxd    : 16
nsetidmax : 0
endgidmax : 0
anatt     : 0
anacap    : 0
  [7:7] : 0	Non-zero group ID Not Supported
  [6:6] : 0	Group ID does change
  [4:4] : 0	ANA Change state Not Supported
  [3:3] : 0	ANA Persistent Loss state Not Supported
  [2:2] : 0	ANA Inaccessible state Not Supported
  [1:1] : 0	ANA Non-optimized state Not Supported
  [0:0] : 0	ANA Optimized state Not Supported

anagrpmax : 0
nanagrpid : 0
pels      : 0
domainid  : 0
megcap    : 0
tmpthha   : 0
  [2:0] : 0	Temperature Threshold Maximum Hysteresis

sqes      : 0x66
  [7:4] : 0x6	Max SQ Entry Size (64)
  [3:0] : 0x6	Min SQ Entry Size (64)

cqes      : 0x44
  [7:4] : 0x4	Max CQ Entry Size (16)
  [3:0] : 0x4	Min CQ Entry Size (16)

maxcmd    : 4
nn        : 1
oncs      : 0x14
  [10:10] : 0	All Fast Copy Not Supported
  [9:9] : 0	Copy Single Atomicity Not Supported
  [8:8] : 0	Copy Not Supported
  [7:7] : 0	Verify Not Supported
  [6:6] : 0	Timestamp Not Supported
  [5:5] : 0	Reservations Not Supported
  [4:4] : 0x1	Save and Select Supported
  [3:3] : 0	Write Zeroes Not Supported
  [2:2] : 0x1	Data Set Management Supported
  [1:1] : 0	Write Uncorrectable Not Supported
  [0:0] : 0	Compare Not Supported

fuses     : 0
  [0:0] : 0	Fused Compare and Write Not Supported

fna       : 0
  [3:3] : 0	Format NVM Broadcast NSID (FFFFFFFFh) Supported
  [2:2] : 0	Crypto Erase Not Supported as part of Secure Erase
  [1:1] : 0	Crypto Erase Applies to Single Namespace(s)
  [0:0] : 0	Format Applies to Single Namespace(s)

vwc       : 0x5
  [2:1] : 0x2	The Flush command does not support NSID set to FFFFFFFFh
  [0:0] : 0x1	Volatile Write Cache Present

awun      : 0
awupf     : 0
icsvscc   : 1
  [0:0] : 0x1	NVM Vendor Specific Commands uses NVMe Format

nwpc      : 0
  [2:2] : 0	Permanent Write Protect Not Supported
  [1:1] : 0	Write Protect Until Power Supply Not Supported
  [0:0] : 0	No Write Protect and Write Protect Namespace Not Supported

acwu      : 0
ocfs      : 0
  [3:3] : 0	Controller Copy Format 3h Not Supported
  [2:2] : 0	Controller Copy Format 2h Not Supported
  [1:1] : 0	Controller Copy Format 1h Not Supported
  [0:0] : 0	Controller Copy Format 0h Not Supported

sgls      : 0
 [15:8] : 0	SGL Descriptor Threshold
 [1:0]  : 0	Scatter-Gather Lists Not Supported

mnan      : 0
maxdna    : 0
maxcna    : 0
oaqd      : 0
subnqn    : nqn.2018-05.com.example:nvme:nvm-subsystem-O2024051002000510    
ioccsz    : 0
iorcsz    : 0
icdoff    : 0
fcatt     : 0
  [0:0] : 0	Dynamic Controller Model

msdbd     : 0
ofcs      : 0
  [0:0] : 0	Disconnect command Not Supported

ps      0 : mp:8.00W operational enlat:0 exlat:0 rrt:0 rrl:0
            rwt:0 rwl:0 idle_power:- active_power:-
            active_power_workload:-
ps      1 : mp:5.00W operational enlat:0 exlat:0 rrt:1 rrl:1
            rwt:1 rwl:1 idle_power:- active_power:-
            active_power_workload:-
ps      2 : mp:4.00W operational enlat:0 exlat:0 rrt:2 rrl:2
            rwt:2 rwl:2 idle_power:- active_power:-
            active_power_workload:-
ps      3 : mp:0.1000W non-operational enlat:5000 exlat:10000 rrt:3 rrl:3
            rwt:3 rwl:3 idle_power:- active_power:-
            active_power_workload:-
ps      4 : mp:0.0050W non-operational enlat:17000 exlat:60000 rrt:4 rrl:4
            rwt:4 rwl:4 idle_power:- active_power:-
            active_power_workload:-