smartctl 7.4 2023-08-01 r5530 [x86_64-linux-6.12.0-55.12.1.el10_0.x86_64] (local build)
Copyright (C) 2002-23, Bruce Allen, Christian Franke, www.smartmontools.org

=== START OF INFORMATION SECTION ===
Model Number:                       SAMSUNG MZVL21T0HCLR-00BH1
Serial Number:                      
Firmware Version:                   HPS4NGXH
PCI Vendor/Subsystem ID:            0x144d
IEEE OUI Identifier:                0x002538
Total NVM Capacity:                 1,024,209,543,168 [1.02 TB]
Unallocated NVM Capacity:           0
Controller ID:                      6
NVMe Version:                       1.3
Number of Namespaces:               1
Namespace 1 Size/Capacity:          1,024,209,543,168 [1.02 TB]
Namespace 1 Utilization:            769,716,518,912 [769 GB]
Namespace 1 Formatted LBA Size:     512
Namespace 1 IEEE EUI-64:            002538 b251b12a3c
Local Time is:                      Wed Jul  9 20:58:11 2025 KST
Firmware Updates (0x16):            3 Slots, no Reset required
Optional Admin Commands (0x0017):   Security Format Frmw_DL Self_Test
Optional NVM Commands (0x0057):     Comp Wr_Unc DS_Mngmt Sav/Sel_Feat Timestmp
Log Page Attributes (0x0f):         S/H_per_NS Cmd_Eff_Lg Ext_Get_Lg Telmtry_Lg
Maximum Data Transfer Size:         128 Pages
Warning  Comp. Temp. Threshold:     81 Celsius
Critical Comp. Temp. Threshold:     85 Celsius

Supported Power States
St Op     Max   Active     Idle   RL RT WL WT  Ent_Lat  Ex_Lat
 0 +     8.48W       -        -    0  0  0  0        0       0
 1 +     5.03W       -        -    1  1  1  1        0     200
 2 +     4.36W       -        -    2  2  2  2        0    1000
 3 -   0.0500W       -        -    3  3  3  3     2000    1200
 4 -   0.0050W       -        -    4  4  4  4      500    9500

Supported LBA Sizes (NSID 0x1)
Id Fmt  Data  Metadt  Rel_Perf
 0 +     512       0         0
 1 -    4096       0         0

=== START OF SMART DATA SECTION ===
SMART overall-health self-assessment test result: PASSED

SMART/Health Information (NVMe Log 0x02)
Critical Warning:                   0x00
Temperature:                        33 Celsius
Available Spare:                    100%
Available Spare Threshold:          5%
Percentage Used:                    0%
Data Units Read:                    4,576,256 [2.34 TB]
Data Units Written:                 16,408,786 [8.40 TB]
Host Read Commands:                 87,619,710
Host Write Commands:                104,132,911
Controller Busy Time:               106
Power Cycles:                       279
Power On Hours:                     14
Unsafe Shutdowns:                   31
Media and Data Integrity Errors:    0
Error Information Log Entries:      0
Warning  Comp. Temperature Time:    0
Critical Comp. Temperature Time:    0
Temperature Sensor 1:               33 Celsius
Temperature Sensor 2:               35 Celsius

Error Information (NVMe Log 0x01, 16 of 256 entries)
No Errors Logged

Self-test Log (NVMe Log 0x06)
Self-test status: No self-test in progress
Num  Test_Description  Status                       Power_on_Hours  Failing_LBA  NSID Seg SCT Code
 0   Short             Completed without error                   5            -     -   -   -    -
 1   Short             Completed without error                   5            -     -   -   -    -
 2   Short             Completed without error                   4            -     -   -   -    -
 3   Short             Completed without error                   4            -     -   -   -    -
 4   Short             Completed without error                   4            -     -   -   -    -
 5   Short             Completed without error                   3            -     -   -   -    -
 6   Short             Completed without error                   3            -     -   -   -    -
 7   Short             Completed without error                   2            -     -   -   -    -
 8   Short             Completed without error                   2            -     -   -   -    -
 9   Short             Completed without error                   2            -     -   -   -    -
10   Short             Completed without error                   1            -     -   -   -    -
11   Short             Completed without error                   1            -     -   -   -    -
12   Short             Completed without error                   0            -     -   -   -    -
