smartctl 7.4 2023-08-01 r5530 [x86_64-linux-6.12.0-211.26.1.el10_2.x86_64] (local build)
Copyright (C) 2002-23, Bruce Allen, Christian Franke, www.smartmontools.org

=== START OF INFORMATION SECTION ===
Model Number:                       INTEL SSDPF21Q016TB
Serial Number:                      
Firmware Version:                   L0310600
PCI Vendor/Subsystem ID:            0x8086
IEEE OUI Identifier:                0x5cd2e4
Total NVM Capacity:                 1,600,321,314,816 [1.60 TB]
Unallocated NVM Capacity:           0
Controller ID:                      0
NVMe Version:                       1.4
Number of Namespaces:               128
Namespace 1 Size/Capacity:          1,600,321,314,816 [1.60 TB]
Namespace 1 Formatted LBA Size:     512
Namespace 1 IEEE EUI-64:            5cd2e4 20c5680300
Local Time is:                      Wed Aug 12 20:29:30 2026 KST
Firmware Updates (0x18):            4 Slots, no Reset required
Optional Admin Commands (0x001e):   Format Frmw_DL NS_Mngmt Self_Test
Optional NVM Commands (0x005e):     Wr_Unc DS_Mngmt Wr_Zero Sav/Sel_Feat Timestmp
Log Page Attributes (0x1e):         Cmd_Eff_Lg Ext_Get_Lg Telmtry_Lg Pers_Ev_Lg
Maximum Data Transfer Size:         32 Pages
Warning  Comp. Temp. Threshold:     70 Celsius
Critical Comp. Temp. Threshold:     80 Celsius
Namespace 1 Features (0x12):        NA_Fields NP_Fields

Supported Power States
St Op     Max   Active     Idle   RL RT WL WT  Ent_Lat  Ex_Lat
 0 +    22.00W       -        -    0  0  0  0        0       0
 1 +    20.00W       -        -    0  1  0  1        0       0
 2 +    18.00W       -        -    0  2  0  2        0       0

Supported LBA Sizes (NSID 0x1)
Id Fmt  Data  Metadt  Rel_Perf
 0 +     512       0         2
 1 -     512       8         2
 2 -    4096       0         2
 3 -    4096       8         2
 4 -    4096      64         2

=== START OF SMART DATA SECTION ===
SMART overall-health self-assessment test result: PASSED

SMART/Health Information (NVMe Log 0x02)
Critical Warning:                   0x00
Temperature:                        32 Celsius
Available Spare:                    100%
Available Spare Threshold:          0%
Percentage Used:                    2%
Data Units Read:                    19,715,519,475 [10.0 PB]
Data Units Written:                 10,361,677,714 [5.30 PB]
Host Read Commands:                 384,505,321,736
Host Write Commands:                40,574,696,911
Controller Busy Time:               67,016
Power Cycles:                       77
Power On Hours:                     31,361
Unsafe Shutdowns:                   31
Media and Data Integrity Errors:    0
Error Information Log Entries:      0
Warning  Comp. Temperature Time:    0
Critical Comp. Temperature Time:    0

Error Information (NVMe Log 0x01, 16 of 256 entries)
No Errors Logged

Self-test Log (NVMe Log 0x06)
Self-test status: No self-test in progress
No Self-tests Logged
