NVME Identify Controller:
vid       : 0x1344
ssvid     : 0x1344
sn        : 
mn        : Micron_7300_MTFDHBE3T2TDG               
fr        : 95420100
rab       : 0
ieee      : 00a075
cmic      : 0
  [3:3] : 0	ANA not supported
  [2:2] : 0	PCI
  [1:1] : 0	Single Controller
  [0:0] : 0	Single Port

mdts      : 5
cntlid    : 0x1
ver       : 0x10300
rtd3r     : 0x989680
rtd3e     : 0x4c4b40
oaes      : 0x100
  [31:31] : 0	Discovery Log Change Notice Not Supported
  [27:27] : 0	Zone Descriptor Changed Notices Not Supported
  [16:16] : 0	Temperature Threshold Hysteresis Recovery Not Supported
  [15:15] : 0	Normal NSS Shutdown Event Not Supported
  [14:14] : 0	Endurance Group Event Aggregate Log Page Change Notice Not Supported
  [13:13] : 0	LBA Status Information Notices Not Supported
  [12:12] : 0	Predictable Latency Event Aggregate Log Change Notices Not Supported
  [11:11] : 0	Asymmetric Namespace Access Change Notices Not Supported
  [9:9] : 0	Firmware Activation Notices Not Supported
  [8:8] : 0x1	Namespace Attribute Changed Event Supported

ctratt    : 0
  [19:19] : 0	Flexible Data Placement Not Supported
  [17:17] : 0	HMB Restrict Non-Operational Power State Access Not Supported
  [16:16] : 0	MDTS and Size Limits Exclude Metadata Not Supported
  [15:15] : 0	Extended LBA Formats Not Supported
  [14:14] : 0	Delete NVM Set Not Supported
  [13:13] : 0	Delete Endurance Group Not Supported
  [12:12] : 0	Variable Capacity Management Not Supported
  [11:11] : 0	Fixed Capacity Management Not Supported
  [10:10] : 0	Multi Domain Subsystem Not Supported
  [9:9] : 0	UUID List Not Supported
  [8:8] : 0	SQ Associations Not Supported
  [7:7] : 0	Namespace Granularity Not Supported
  [6:6] : 0	Traffic Based Keep Alive Not Supported
  [5:5] : 0	Predictable Latency Mode Not Supported
  [4:4] : 0	Endurance Groups Not Supported
  [3:3] : 0	Read Recovery Levels Not Supported
  [2:2] : 0	NVM Sets Not Supported
  [1:1] : 0	Non-Operational Power State Permissive Not Supported
  [0:0] : 0	128-bit Host Identifier Not Supported

rrls      : 0
cntrltype : 0
  [7:2] : 0	Reserved
  [1:0] : 0	Controller type not reported
fguid     : 00000000-0000-0000-0000-000000000000
crdt1     : 0
crdt2     : 0
crdt3     : 0
nvmsr     : 0
  [1:1] : 0	NVM subsystem Not part of an Enclosure
  [0:0] : 0	NVM subsystem Not part of a Storage Device

vwci      : 0
  [7:7] : 0	VPD Write Cycles Remaining field is Not valid.
  [6:0] : 0	VPD Write Cycles Remaining

mec       : 0
  [1:1] : 0	NVM subsystem Not contains a Management Endpoint on a PCIe port
  [0:0] : 0	NVM subsystem Not contains a Management Endpoint on an SMBus/I2C port

oacs      : 0x1e
  [10:10] : 0	Lockdown Command and Feature Not Supported
  [9:9] : 0	Get LBA Status Capability Not Supported
  [8:8] : 0	Doorbell Buffer Config Not Supported
  [7:7] : 0	Virtualization Management Not Supported
  [6:6] : 0	NVMe-MI Send and Receive Not Supported
  [5:5] : 0	Directives Not Supported
  [4:4] : 0x1	Device Self-test Supported
  [3:3] : 0x1	NS Management and Attachment Supported
  [2:2] : 0x1	FW Commit and Download Supported
  [1:1] : 0x1	Format NVM Supported
  [0:0] : 0	Security Send and Receive Not Supported

acl       : 3
aerl      : 4
frmw      : 0x17
  [5:5] : 0	Multiple FW or Boot Update Detection Not Supported
  [4:4] : 0x1	Firmware Activate Without Reset Supported
  [3:1] : 0x3	Number of Firmware Slots
  [0:0] : 0x1	Firmware Slot 1 Read-Only

lpa       : 0x2
  [6:6] : 0	Telemetry Log Data Area 4 Not Supported
  [5:5] : 0	LID 0x0, Scope of each command in LID 0x5, 0x12, 0x13 Not Supported
  [4:4] : 0	Persistent Event log Not Supported
  [3:3] : 0	Telemetry host/controller initiated log page Not Supported
  [2:2] : 0	Extended data for Get Log Page Not Supported
  [1:1] : 0x1	Command Effects Log Page Supported
  [0:0] : 0	SMART/Health Log Page per NS Not Supported

elpe      : 62
  [7:0] : 62 (0's based)	Error Log Page Entries (ELPE)

npss      : 7
  [7:0] : 7 (0's based)	Number of Power States Support (NPSS)

avscc     : 0x1
  [0:0] : 0x1	Admin Vendor Specific Commands uses NVMe Format

apsta     : 0
  [0:0] : 0	Autonomous Power State Transitions Not Supported

wctemp    : 345
 [15:0] : 161 째F (345 K)	Warning Composite Temperature Threshold (WCTEMP)

cctemp    : 348
 [15:0] : 167 째F (348 K)	Critical Composite Temperature Threshold (CCTEMP)

mtfa      : 150
hmpre     : 0
hmmin     : 0
tnvmcap   : 3,200,631,791,616
[127:0] : 3,200,631,791,616
	Total NVM Capacity (TNVMCAP)

unvmcap   : 0
[127:0] : 0
	Unallocated NVM Capacity (UNVMCAP)

rpmbs     : 0
 [31:24]: 0	Access Size
 [23:16]: 0	Total Size
  [5:3] : 0	Authentication Method
  [2:0] : 0	Number of RPMB Units

edstt     : 0
dsto      : 1
fwug      : 1
kas       : 0
hctma     : 0
  [0:0] : 0	Host Controlled Thermal Management Not Supported

mntmt     : 0
 [15:0] : -459 째F (0 K)	Minimum Thermal Management Temperature (MNTMT)

mxtmt     : 0
 [15:0] : -459 째F (0 K)	Maximum Thermal Management Temperature (MXTMT)

sanicap   : 0
  [31:30] : 0	Additional media modification after sanitize operation completes successfully is not defined
  [29:29] : 0	No-Deallocate After Sanitize bit in Sanitize command Supported
  [3:3] : 0	Media Verification and Post-Verification Deallocation state Not Supported
  [2:2] : 0	Overwrite Sanitize Operation Not Supported
  [1:1] : 0	Block Erase Sanitize Operation Not Supported
  [0:0] : 0	Crypto Erase Sanitize Operation Not Supported

hmminds   : 0
hmmaxd    : 0
nsetidmax : 0
endgidmax : 0
anatt     : 0
anacap    : 0
  [7:7] : 0	Non-zero group ID Not Supported
  [6:6] : 0	Group ID does change
  [4:4] : 0	ANA Change state Not Supported
  [3:3] : 0	ANA Persistent Loss state Not Supported
  [2:2] : 0	ANA Inaccessible state Not Supported
  [1:1] : 0	ANA Non-optimized state Not Supported
  [0:0] : 0	ANA Optimized state Not Supported

anagrpmax : 0
nanagrpid : 0
pels      : 0
domainid  : 0
megcap    : 0
tmpthha   : 0
  [2:0] : 0	Temperature Threshold Maximum Hysteresis

sqes      : 0x66
  [7:4] : 0x6	Max SQ Entry Size (64)
  [3:0] : 0x6	Min SQ Entry Size (64)

cqes      : 0x44
  [7:4] : 0x4	Max CQ Entry Size (16)
  [3:0] : 0x4	Min CQ Entry Size (16)

maxcmd    : 0
nn        : 1
oncs      : 0x34
  [10:10] : 0	All Fast Copy Not Supported
  [9:9] : 0	Copy Single Atomicity Not Supported
  [8:8] : 0	Copy Not Supported
  [7:7] : 0	Verify Not Supported
  [6:6] : 0	Timestamp Not Supported
  [5:5] : 0x1	Reservations Supported
  [4:4] : 0x1	Save and Select Supported
  [3:3] : 0	Write Zeroes Not Supported
  [2:2] : 0x1	Data Set Management Supported
  [1:1] : 0	Write Uncorrectable Not Supported
  [0:0] : 0	Compare Not Supported

fuses     : 0
  [0:0] : 0	Fused Compare and Write Not Supported

fna       : 0
  [3:3] : 0	Format NVM Broadcast NSID (FFFFFFFFh) Supported
  [2:2] : 0	Crypto Erase Not Supported as part of Secure Erase
  [1:1] : 0	Crypto Erase Applies to Single Namespace(s)
  [0:0] : 0	Format Applies to Single Namespace(s)

vwc       : 0
  [2:1] : 0	Support for the NSID field set to FFFFFFFFh is not indicated
  [0:0] : 0	Volatile Write Cache Not Present

awun      : 0
awupf     : 0
icsvscc   : 1
  [0:0] : 0x1	NVM Vendor Specific Commands uses NVMe Format

nwpc      : 0
  [2:2] : 0	Permanent Write Protect Not Supported
  [1:1] : 0	Write Protect Until Power Supply Not Supported
  [0:0] : 0	No Write Protect and Write Protect Namespace Not Supported

acwu      : 0
ocfs      : 0
  [3:3] : 0	Controller Copy Format 3h Not Supported
  [2:2] : 0	Controller Copy Format 2h Not Supported
  [1:1] : 0	Controller Copy Format 1h Not Supported
  [0:0] : 0	Controller Copy Format 0h Not Supported

sgls      : 0
 [15:8] : 0	SGL Descriptor Threshold
 [1:0]  : 0	Scatter-Gather Lists Not Supported

mnan      : 0
maxdna    : 0
maxcna    : 0
oaqd      : 0
subnqn    : nqn.2016-08.com.micron:nvme:nvm-subsystem-sn-20392CBE131A        
ioccsz    : 0
iorcsz    : 0
icdoff    : 0
fcatt     : 0
  [0:0] : 0	Dynamic Controller Model

msdbd     : 0
ofcs      : 0
  [0:0] : 0	Disconnect command Not Supported

ps      0 : mp:12.00W operational enlat:0 exlat:0 rrt:0 rrl:0
            rwt:0 rwl:0 idle_power:- active_power:-
            active_power_workload:-
ps      1 : mp:11.00W operational enlat:0 exlat:0 rrt:1 rrl:1
            rwt:1 rwl:1 idle_power:- active_power:-
            active_power_workload:-
ps      2 : mp:10.00W operational enlat:0 exlat:0 rrt:2 rrl:2
            rwt:2 rwl:2 idle_power:- active_power:-
            active_power_workload:-
ps      3 : mp:9.00W operational enlat:0 exlat:0 rrt:3 rrl:3
            rwt:3 rwl:3 idle_power:- active_power:-
            active_power_workload:-
ps      4 : mp:8.00W operational enlat:0 exlat:0 rrt:4 rrl:4
            rwt:4 rwl:4 idle_power:- active_power:-
            active_power_workload:-
ps      5 : mp:7.00W operational enlat:0 exlat:0 rrt:5 rrl:5
            rwt:5 rwl:5 idle_power:- active_power:-
            active_power_workload:-
ps      6 : mp:6.00W operational enlat:0 exlat:0 rrt:6 rrl:6
            rwt:6 rwl:6 idle_power:- active_power:-
            active_power_workload:-
ps      7 : mp:5.00W operational enlat:0 exlat:0 rrt:7 rrl:7
            rwt:7 rwl:7 idle_power:- active_power:-
            active_power_workload:-