smartctl 7.4 2023-08-01 r5530 [x86_64-linux-6.12.0-55.12.1.el10_0.x86_64] (local build)
Copyright (C) 2002-23, Bruce Allen, Christian Franke, www.smartmontools.org

=== START OF INFORMATION SECTION ===
Model Number:                       INTEL SSDPED1K375GA
Serial Number:                      
Firmware Version:                   E2010650
PCI Vendor/Subsystem ID:            0x8086
IEEE OUI Identifier:                0x5cd2e4
Controller ID:                      0
NVMe Version:                       <1.2
Number of Namespaces:               1
Namespace 1 Size/Capacity:          375,083,606,016 [375 GB]
Namespace 1 Formatted LBA Size:     512
Namespace 1 IEEE EUI-64:            5cd2e4 f8a23b0100
Local Time is:                      Sun Jan  4 10:41:40 2026 KST
Firmware Updates (0x02):            1 Slot
Optional Admin Commands (0x0007):   Security Format Frmw_DL
Optional NVM Commands (0x0006):     Wr_Unc DS_Mngmt
Log Page Attributes (0x0a):         Cmd_Eff_Lg Telmtry_Lg
Maximum Data Transfer Size:         32 Pages

Supported Power States
St Op     Max   Active     Idle   RL RT WL WT  Ent_Lat  Ex_Lat
 0 +    18.00W       -        -    0  0  0  0        0       0

Supported LBA Sizes (NSID 0x1)
Id Fmt  Data  Metadt  Rel_Perf
 0 +     512       0         2
 1 -     512       8         2
 2 -     512      16         2
 3 -    4096       0         0
 4 -    4096       8         0
 5 -    4096      64         0
 6 -    4096     128         0

=== START OF SMART DATA SECTION ===
SMART overall-health self-assessment test result: PASSED

SMART/Health Information (NVMe Log 0x02)
Critical Warning:                   0x00
Temperature:                        26 Celsius
Available Spare:                    100%
Available Spare Threshold:          0%
Percentage Used:                    0%
Data Units Read:                    6,489,798,254 [3.32 PB]
Data Units Written:                 138,742,251 [71.0 TB]
Host Read Commands:                 153,579,648,273
Host Write Commands:                17,289,662,704
Controller Busy Time:               28,054
Power Cycles:                       65
Power On Hours:                     59,717
Unsafe Shutdowns:                   38
Media and Data Integrity Errors:    0
Error Information Log Entries:      0

Error Information (NVMe Log 0x01, 16 of 64 entries)
Num   ErrCount  SQId   CmdId  Status  PELoc          LBA  NSID    VS  Message
  0          1     0       -  0xc00c      -            0     -     -  Internal Error

Self-tests not supported

