smartctl 7.4 2023-08-01 r5530 [x86_64-linux-6.12.0-55.20.1.el10_0.x86_64] (local build)
Copyright (C) 2002-23, Bruce Allen, Christian Franke, www.smartmontools.org

=== START OF INFORMATION SECTION ===
Model Number:                       SAMSUNG MZ1JB240HMGG-000FB
Serial Number:                      
Firmware Version:                   EDZ71F5Q
PCI Vendor/Subsystem ID:            0x144d
IEEE OUI Identifier:                0x002538
Total NVM Capacity:                 240,057,409,536 [240 GB]
Unallocated NVM Capacity:           0
Controller ID:                      4
NVMe Version:                       1.2
Number of Namespaces:               1
Namespace 1 Size/Capacity:          240,057,409,536 [240 GB]
Namespace 1 Utilization:            0
Namespace 1 Formatted LBA Size:     4096
Local Time is:                      Wed Aug  6 08:35:57 2025 KST
Firmware Updates (0x17):            3 Slots, Slot 1 R/O, no Reset required
Optional Admin Commands (0x000f):   Security Format Frmw_DL NS_Mngmt
Optional NVM Commands (0x005f):     Comp Wr_Unc DS_Mngmt Wr_Zero Sav/Sel_Feat Timestmp
Log Page Attributes (0x0f):         S/H_per_NS Cmd_Eff_Lg Ext_Get_Lg Telmtry_Lg
Maximum Data Transfer Size:         128 Pages
Warning  Comp. Temp. Threshold:     77 Celsius
Critical Comp. Temp. Threshold:     87 Celsius
Namespace 1 Features (0x02):        NA_Fields

Supported Power States
St Op     Max   Active     Idle   RL RT WL WT  Ent_Lat  Ex_Lat
 0 +     8.00W       -        -    0  0  0  0        0       0

Supported LBA Sizes (NSID 0x1)
Id Fmt  Data  Metadt  Rel_Perf
 0 +    4096       0         0

=== START OF SMART DATA SECTION ===
SMART overall-health self-assessment test result: PASSED

SMART/Health Information (NVMe Log 0x02)
Critical Warning:                   0x00
Temperature:                        34 Celsius
Available Spare:                    100%
Available Spare Threshold:          10%
Percentage Used:                    0%
Data Units Read:                    46,079,524 [23.5 TB]
Data Units Written:                 36,496,603 [18.6 TB]
Host Read Commands:                 714,629,654
Host Write Commands:                721,339,482
Controller Busy Time:               478
Power Cycles:                       1,233
Power On Hours:                     10,642
Unsafe Shutdowns:                   482
Media and Data Integrity Errors:    0
Error Information Log Entries:      4,687
Warning  Comp. Temperature Time:    59
Critical Comp. Temperature Time:    0
Temperature Sensor 1:               34 Celsius
Temperature Sensor 2:               36 Celsius
Temperature Sensor 3:               38 Celsius

Error Information (NVMe Log 0x01, 16 of 64 entries)
Num   ErrCount  SQId   CmdId  Status  PELoc          LBA  NSID    VS  Message
  0       4687     0  0x0000  0x4004      -            0     0     -  Invalid Field in Command
  1       4686     0  0x101d  0x4004      -            0     0     -  Invalid Field in Command

Self-tests not supported
