smartctl 7.4 2023-08-01 r5530 [x86_64-linux-6.12.0-55.20.1.el10_0.x86_64] (local build)
Copyright (C) 2002-23, Bruce Allen, Christian Franke, www.smartmontools.org

=== START OF INFORMATION SECTION ===
Model Number:                       MS1PC5ED3ORA3.2T
Serial Number:                      
Firmware Version:                   KPYAJR3Q
PCI Vendor ID:                      0x144d
PCI Vendor Subsystem ID:            0x108e
IEEE OUI Identifier:                0x002538
Controller ID:                      0
NVMe Version:                       <1.2
Number of Namespaces:               1
Namespace 1 Size/Capacity:          3,200,631,791,616 [3.20 TB]
Namespace 1 Formatted LBA Size:     512
Namespace 1 IEEE EUI-64:            002538 9a710024ae
Local Time is:                      Sat Aug  2 16:14:30 2025 KST
Firmware Updates (0x02):            1 Slot
Optional Admin Commands (0x0006):   Format Frmw_DL
Optional NVM Commands (0x0004):     DS_Mngmt
Maximum Data Transfer Size:         32 Pages

Supported Power States
St Op     Max   Active     Idle   RL RT WL WT  Ent_Lat  Ex_Lat
 0 +    25.00W       -        -    0  0  0  0      100     100

Supported LBA Sizes (NSID 0x1)
Id Fmt  Data  Metadt  Rel_Perf
 0 -     512       0         1
 1 -     512       8         3
 2 -    4096       0         0
 3 -    4096       8         2

=== START OF SMART DATA SECTION ===
SMART overall-health self-assessment test result: PASSED

SMART/Health Information (NVMe Log 0x02)
Critical Warning:                   0x00
Temperature:                        37 Celsius
Available Spare:                    100%
Available Spare Threshold:          10%
Percentage Used:                    3%
Data Units Read:                    82,909,397,440 [42.4 PB]
Data Units Written:                 3,092,668,385 [1.58 PB]
Host Read Commands:                 715,749,497,181
Host Write Commands:                54,269,396,457
Controller Busy Time:               356,700
Power Cycles:                       56
Power On Hours:                     65,482
Unsafe Shutdowns:                   40
Media and Data Integrity Errors:    0
Error Information Log Entries:      0

Error Information (NVMe Log 0x01, 16 of 256 entries)
No Errors Logged

Self-tests not supported

