smartctl 7.4 2023-08-01 r5530 [x86_64-linux-6.12.0-55.20.1.el10_0.x86_64] (local build)
Copyright (C) 2002-23, Bruce Allen, Christian Franke, www.smartmontools.org

=== START OF INFORMATION SECTION ===
Model Number:                       INTEL SSDPEL1C100GA
Serial Number:                      
Firmware Version:                   E2010603
PCI Vendor/Subsystem ID:            0x8086
IEEE OUI Identifier:                0x5cd2e4
Controller ID:                      0
NVMe Version:                       <1.2
Number of Namespaces:               1
Namespace 1 Size/Capacity:          100,030,242,816 [100 GB]
Namespace 1 Formatted LBA Size:     512
Namespace 1 IEEE EUI-64:            5cd2e4 f0e1ea0100
Local Time is:                      Mon Oct 13 18:02:32 2025 KST
Firmware Updates (0x02):            1 Slot
Optional Admin Commands (0x0007):   Security Format Frmw_DL
Optional NVM Commands (0x0006):     Wr_Unc DS_Mngmt
Log Page Attributes (0x0a):         Cmd_Eff_Lg Telmtry_Lg
Maximum Data Transfer Size:         32 Pages

Supported Power States
St Op     Max   Active     Idle   RL RT WL WT  Ent_Lat  Ex_Lat
 0 +    10.00W       -        -    0  0  0  0        0       0

Supported LBA Sizes (NSID 0x1)
Id Fmt  Data  Metadt  Rel_Perf
 0 +     512       0         2
 1 -     512       8         2
 2 -     512      16         2
 3 -    4096       0         0
 4 -    4096       8         0
 5 -    4096      64         0
 6 -    4096     128         0

=== START OF SMART DATA SECTION ===
SMART overall-health self-assessment test result: PASSED

SMART/Health Information (NVMe Log 0x02)
Critical Warning:                   0x00
Temperature:                        18 Celsius
Available Spare:                    100%
Available Spare Threshold:          0%
Percentage Used:                    0%
Data Units Read:                    4,308,355 [2.20 TB]
Data Units Written:                 5,243,221 [2.68 TB]
Host Read Commands:                 105,431,034
Host Write Commands:                73,940,621
Controller Busy Time:               59
Power Cycles:                       155
Power On Hours:                     281
Unsafe Shutdowns:                   65
Media and Data Integrity Errors:    219
Error Information Log Entries:      215

Error Information (NVMe Log 0x01, 16 of 64 entries)
Num   ErrCount  SQId   CmdId  Status  PELoc          LBA  NSID    VS  Message
  0        215    16  0x000d  0xc502  0x000      6156472     1     -  Unrecovered Read Error
  1        214    16  0x000c  0xc502  0x000      6156472     1     -  Unrecovered Read Error
  2        213    16  0x0006  0xc502  0x000      6156456     1     -  Unrecovered Read Error
  3        212    16  0x0005  0xc502  0x000      6156456     1     -  Unrecovered Read Error
  4        211     3  0xc00b  0xc502  0x000      6156456     1     -  Unrecovered Read Error
  5        210    13  0x0016  0xc502  0x000        54072     1     -  Unrecovered Read Error
  6        209    16  0x0040  0xc502  0x000        53816     1     -  Unrecovered Read Error
  7        208    13  0x0015  0xc502  0x000        53816     1     -  Unrecovered Read Error
  8        207    16  0x003f  0xc502  0x000        53560     1     -  Unrecovered Read Error
  9        206    13  0x0014  0xc502  0x000        53560     1     -  Unrecovered Read Error
 10        205    16  0x003e  0xc502  0x000        53304     1     -  Unrecovered Read Error
 11        204    13  0x0013  0xc502  0x000        53304     1     -  Unrecovered Read Error
 12        203    16  0x003d  0xc502  0x000        53048     1     -  Unrecovered Read Error
 13        202    13  0x0012  0xc502  0x000        53048     1     -  Unrecovered Read Error
 14        201    16  0x003c  0xc502  0x000        52792     1     -  Unrecovered Read Error
 15        200    13  0x0011  0xc502  0x000        52792     1     -  Unrecovered Read Error
... (48 entries not read)

Self-tests not supported

