smartctl 7.4 2023-08-01 r5530 [x86_64-linux-6.12.0-55.12.1.el10_0.x86_64] (local build)
Copyright (C) 2002-23, Bruce Allen, Christian Franke, www.smartmontools.org

=== START OF INFORMATION SECTION ===
Model Number:                       WD_BLACK SN850X 4000GB
Serial Number:                      
Firmware Version:                   624361WD
PCI Vendor/Subsystem ID:            0x15b7
IEEE OUI Identifier:                0x001b44
Total NVM Capacity:                 4,000,787,030,016 [4.00 TB]
Unallocated NVM Capacity:           0
Controller ID:                      8224
NVMe Version:                       1.4
Number of Namespaces:               1
Namespace 1 Size/Capacity:          4,000,787,030,016 [4.00 TB]
Namespace 1 Formatted LBA Size:     512
Namespace 1 IEEE EUI-64:            001b44 8b4f583e7d
Local Time is:                      Wed May  6 18:42:27 2026 KST
Firmware Updates (0x14):            2 Slots, no Reset required
Optional Admin Commands (0x0017):   Security Format Frmw_DL Self_Test
Optional NVM Commands (0x00df):     Comp Wr_Unc DS_Mngmt Wr_Zero Sav/Sel_Feat Timestmp Verify
Log Page Attributes (0x1e):         Cmd_Eff_Lg Ext_Get_Lg Telmtry_Lg Pers_Ev_Lg
Maximum Data Transfer Size:         128 Pages
Warning  Comp. Temp. Threshold:     90 Celsius
Critical Comp. Temp. Threshold:     94 Celsius
Namespace 1 Features (0x02):        NA_Fields

Supported Power States
St Op     Max   Active     Idle   RL RT WL WT  Ent_Lat  Ex_Lat
 0 +     9.00W    9.00W       -    0  0  0  0        0       0
 1 +     6.00W    6.00W       -    0  0  0  0        0       0
 2 +     4.50W    4.50W       -    0  0  0  0        0       0
 3 -   0.0250W       -        -    3  3  3  3     3100   11900
 4 -   0.0050W       -        -    4  4  4  4     3900   45700

Supported LBA Sizes (NSID 0x1)
Id Fmt  Data  Metadt  Rel_Perf
 0 +     512       0         2
 1 -    4096       0         1

=== START OF SMART DATA SECTION ===
SMART overall-health self-assessment test result: PASSED

SMART/Health Information (NVMe Log 0x02)
Critical Warning:                   0x00
Temperature:                        36 Celsius
Available Spare:                    100%
Available Spare Threshold:          10%
Percentage Used:                    0%
Data Units Read:                    7,653,106 [3.91 TB]
Data Units Written:                 27,235,873 [13.9 TB]
Host Read Commands:                 570,036,168
Host Write Commands:                238,793,002
Controller Busy Time:               180
Power Cycles:                       22
Power On Hours:                     12
Unsafe Shutdowns:                   14
Media and Data Integrity Errors:    0
Error Information Log Entries:      0
Warning  Comp. Temperature Time:    0
Critical Comp. Temperature Time:    0

Error Information (NVMe Log 0x01, 16 of 256 entries)
No Errors Logged

Read Self-test Log failed: Invalid Field in Command (0x4002)

