NVME Identify Controller:
vid       : 0x1344
ssvid     : 0x1344
sn        :   
mn        : Micron_7450_MTFDKCB1T6TFS               
fr        : E2MU110 
rab       : 3
ieee      : 00a075
cmic      : 0
  [3:3] : 0	ANA not supported
  [2:2] : 0	PCI
  [1:1] : 0	Single Controller
  [0:0] : 0	Single Port

mdts      : 10
cntlid    : 0
ver       : 0x10400
rtd3r     : 0x1e8480
rtd3e     : 0x1e8480
oaes      : 0x300
  [31:31] : 0	Discovery Log Change Notice Not Supported
  [27:27] : 0	Zone Descriptor Changed Notices Not Supported
  [16:16] : 0	Temperature Threshold Hysteresis Recovery Not Supported
  [15:15] : 0	Normal NSS Shutdown Event Not Supported
  [14:14] : 0	Endurance Group Event Aggregate Log Page Change Notice Not Supported
  [13:13] : 0	LBA Status Information Notices Not Supported
  [12:12] : 0	Predictable Latency Event Aggregate Log Change Notices Not Supported
  [11:11] : 0	Asymmetric Namespace Access Change Notices Not Supported
  [9:9] : 0x1	Firmware Activation Notices Supported
  [8:8] : 0x1	Namespace Attribute Changed Event Supported

ctratt    : 0x98
  [19:19] : 0	Flexible Data Placement Not Supported
  [17:17] : 0	HMB Restrict Non-Operational Power State Access Not Supported
  [16:16] : 0	MDTS and Size Limits Exclude Metadata Not Supported
  [15:15] : 0	Extended LBA Formats Not Supported
  [14:14] : 0	Delete NVM Set Not Supported
  [13:13] : 0	Delete Endurance Group Not Supported
  [12:12] : 0	Variable Capacity Management Not Supported
  [11:11] : 0	Fixed Capacity Management Not Supported
  [10:10] : 0	Multi Domain Subsystem Not Supported
  [9:9] : 0	UUID List Not Supported
  [8:8] : 0	SQ Associations Not Supported
  [7:7] : 0x1	Namespace Granularity Supported
  [6:6] : 0	Traffic Based Keep Alive Not Supported
  [5:5] : 0	Predictable Latency Mode Not Supported
  [4:4] : 0x1	Endurance Groups Supported
  [3:3] : 0x1	Read Recovery Levels Supported
  [2:2] : 0	NVM Sets Not Supported
  [1:1] : 0	Non-Operational Power State Permissive Not Supported
  [0:0] : 0	128-bit Host Identifier Not Supported

rrls      : 0x8010
cntrltype : 1
  [7:2] : 0	Reserved
  [1:0] : 0x1	I/O Controller
fguid     : 3ce79b94-0000-0000-00a0-75223ce79b94
crdt1     : 0
crdt2     : 0
crdt3     : 0
nvmsr     : 1
  [1:1] : 0	NVM subsystem Not part of an Enclosure
  [0:0] : 0x1	NVM subsystem part of a Storage Device

vwci      : 255
  [7:7] : 0x1	VPD Write Cycles Remaining field is valid.
  [6:0] : 0xfe	VPD Write Cycles Remaining

mec       : 3
  [1:1] : 0x1	NVM subsystem contains a Management Endpoint on a PCIe port
  [0:0] : 0x1	NVM subsystem contains a Management Endpoint on an SMBus/I2C port

oacs      : 0x5e
  [10:10] : 0	Lockdown Command and Feature Not Supported
  [9:9] : 0	Get LBA Status Capability Not Supported
  [8:8] : 0	Doorbell Buffer Config Not Supported
  [7:7] : 0	Virtualization Management Not Supported
  [6:6] : 0x1	NVMe-MI Send and Receive Supported
  [5:5] : 0	Directives Not Supported
  [4:4] : 0x1	Device Self-test Supported
  [3:3] : 0x1	NS Management and Attachment Supported
  [2:2] : 0x1	FW Commit and Download Supported
  [1:1] : 0x1	Format NVM Supported
  [0:0] : 0	Security Send and Receive Not Supported

acl       : 3
aerl      : 7
frmw      : 0x17
  [5:5] : 0	Multiple FW or Boot Update Detection Not Supported
  [4:4] : 0x1	Firmware Activate Without Reset Supported
  [3:1] : 0x3	Number of Firmware Slots
  [0:0] : 0x1	Firmware Slot 1 Read-Only

lpa       : 0x1e
  [6:6] : 0	Telemetry Log Data Area 4 Not Supported
  [5:5] : 0	LID 0x0, Scope of each command in LID 0x5, 0x12, 0x13 Not Supported
  [4:4] : 0x1	Persistent Event log Supported
  [3:3] : 0x1	Telemetry host/controller initiated log page Supported
  [2:2] : 0x1	Extended data for Get Log Page Supported
  [1:1] : 0x1	Command Effects Log Page Supported
  [0:0] : 0	SMART/Health Log Page per NS Not Supported

elpe      : 255
  [7:0] : 255 (0's based)	Error Log Page Entries (ELPE)

npss      : 4
  [7:0] : 4 (0's based)	Number of Power States Support (NPSS)

avscc     : 0x1
  [0:0] : 0x1	Admin Vendor Specific Commands uses NVMe Format

apsta     : 0
  [0:0] : 0	Autonomous Power State Transitions Not Supported

wctemp    : 350
 [15:0] : 170 째F (350 K)	Warning Composite Temperature Threshold (WCTEMP)

cctemp    : 358
 [15:0] : 185 째F (358 K)	Critical Composite Temperature Threshold (CCTEMP)

mtfa      : 20
hmpre     : 0
hmmin     : 0
tnvmcap   : 1,600,321,314,816
[127:0] : 1,600,321,314,816
	Total NVM Capacity (TNVMCAP)

unvmcap   : 0
[127:0] : 0
	Unallocated NVM Capacity (UNVMCAP)

rpmbs     : 0
 [31:24]: 0	Access Size
 [23:16]: 0	Total Size
  [5:3] : 0	Authentication Method
  [2:0] : 0	Number of RPMB Units

edstt     : 30
dsto      : 1
fwug      : 1
kas       : 0
hctma     : 0x1
  [0:0] : 0x1	Host Controlled Thermal Management Supported

mntmt     : 303
 [15:0] : 86 째F (303 K)	Minimum Thermal Management Temperature (MNTMT)

mxtmt     : 356
 [15:0] : 181 째F (356 K)	Maximum Thermal Management Temperature (MXTMT)

sanicap   : 0xa0000002
  [31:30] : 0x2	Media is additionally modified after sanitize operation completes successfully
  [29:29] : 0x1	No-Deallocate After Sanitize bit in Sanitize command Not Supported
  [3:3] : 0	Media Verification and Post-Verification Deallocation state Not Supported
  [2:2] : 0	Overwrite Sanitize Operation Not Supported
  [1:1] : 0x1	Block Erase Sanitize Operation Supported
  [0:0] : 0	Crypto Erase Sanitize Operation Not Supported

hmminds   : 0
hmmaxd    : 0
nsetidmax : 0
endgidmax : 1
anatt     : 0
anacap    : 0
  [7:7] : 0	Non-zero group ID Not Supported
  [6:6] : 0	Group ID does change
  [4:4] : 0	ANA Change state Not Supported
  [3:3] : 0	ANA Persistent Loss state Not Supported
  [2:2] : 0	ANA Inaccessible state Not Supported
  [1:1] : 0	ANA Non-optimized state Not Supported
  [0:0] : 0	ANA Optimized state Not Supported

anagrpmax : 0
nanagrpid : 0
pels      : 512
domainid  : 0
megcap    : 0
tmpthha   : 0
  [2:0] : 0	Temperature Threshold Maximum Hysteresis

sqes      : 0x66
  [7:4] : 0x6	Max SQ Entry Size (64)
  [3:0] : 0x6	Min SQ Entry Size (64)

cqes      : 0x44
  [7:4] : 0x4	Max CQ Entry Size (16)
  [3:0] : 0x4	Min CQ Entry Size (16)

maxcmd    : 0
nn        : 132
oncs      : 0xdf
  [10:10] : 0	All Fast Copy Not Supported
  [9:9] : 0	Copy Single Atomicity Not Supported
  [8:8] : 0	Copy Not Supported
  [7:7] : 0x1	Verify Supported
  [6:6] : 0x1	Timestamp Supported
  [5:5] : 0	Reservations Not Supported
  [4:4] : 0x1	Save and Select Supported
  [3:3] : 0x1	Write Zeroes Supported
  [2:2] : 0x1	Data Set Management Supported
  [1:1] : 0x1	Write Uncorrectable Supported
  [0:0] : 0x1	Compare Supported

fuses     : 0x1
  [0:0] : 0x1	Fused Compare and Write Supported

fna       : 0
  [3:3] : 0	Format NVM Broadcast NSID (FFFFFFFFh) Supported
  [2:2] : 0	Crypto Erase Not Supported as part of Secure Erase
  [1:1] : 0	Crypto Erase Applies to Single Namespace(s)
  [0:0] : 0	Format Applies to Single Namespace(s)

vwc       : 0x6
  [2:1] : 0x3	The Flush command supports NSID set to FFFFFFFFh
  [0:0] : 0	Volatile Write Cache Not Present

awun      : 63
awupf     : 63
icsvscc   : 1
  [0:0] : 0x1	NVM Vendor Specific Commands uses NVMe Format

nwpc      : 0
  [2:2] : 0	Permanent Write Protect Not Supported
  [1:1] : 0	Write Protect Until Power Supply Not Supported
  [0:0] : 0	No Write Protect and Write Protect Namespace Not Supported

acwu      : 63
ocfs      : 0
  [3:3] : 0	Controller Copy Format 3h Not Supported
  [2:2] : 0	Controller Copy Format 2h Not Supported
  [1:1] : 0	Controller Copy Format 1h Not Supported
  [0:0] : 0	Controller Copy Format 0h Not Supported

sgls      : 0xf0001
 [21:21]: 0	Transport SGL Data Block Descriptor Not Supported
 [20:20]: 0	Address Offsets Not Supported
 [19:19]: 0x1	Metadata Pointer Containing SGL Descriptor is Supported
 [18:18]: 0x1	SGL Length Larger than Buffer Supported
 [17:17]: 0x1	Byte-Aligned Contig. MD Buffer Supported
 [16:16]: 0x1	SGL Bit-Bucket Supported
 [15:8] : 0	SGL Descriptor Threshold
  [2:2] : 0	Keyed SGL Data Block descriptor Not Supported
  [1:0] : 0x1	Scatter-Gather Lists Supported. No Dword alignment required.

mnan      : 0
maxdna    : 0
maxcna    : 0
oaqd      : 0
subnqn    : nqn.2016-08.com.micron:nvme:nvm-subsystem-sn-22353CE79B94        
ioccsz    : 0
iorcsz    : 0
icdoff    : 0
fcatt     : 0
  [0:0] : 0	Dynamic Controller Model

msdbd     : 0
ofcs      : 0
  [0:0] : 0	Disconnect command Not Supported

ps      0 : mp:15.00W operational enlat:0 exlat:0 rrt:0 rrl:0
            rwt:0 rwl:0 idle_power:- active_power:-
            active_power_workload:-
ps      1 : mp:13.00W operational enlat:0 exlat:0 rrt:1 rrl:1
            rwt:1 rwl:1 idle_power:- active_power:-
            active_power_workload:-
ps      2 : mp:11.00W operational enlat:0 exlat:0 rrt:2 rrl:2
            rwt:2 rwl:2 idle_power:- active_power:-
            active_power_workload:-
ps      3 : mp:10.00W operational enlat:0 exlat:0 rrt:3 rrl:3
            rwt:3 rwl:3 idle_power:- active_power:-
            active_power_workload:-
ps      4 : mp:8.25W operational enlat:0 exlat:0 rrt:4 rrl:4
            rwt:4 rwl:4 idle_power:- active_power:-
            active_power_workload:-