smartctl 7.4 2023-08-01 r5530 [x86_64-linux-6.12.0-55.20.1.el10_0.x86_64] (local build)
Copyright (C) 2002-23, Bruce Allen, Christian Franke, www.smartmontools.org

=== START OF INFORMATION SECTION ===
Model Number:                       INTEL SSDPF21Q400GB
Serial Number:                      
Firmware Version:                   L0310200
PCI Vendor/Subsystem ID:            0x8086
IEEE OUI Identifier:                0x5cd2e4
Total NVM Capacity:                 400,088,457,216 [400 GB]
Unallocated NVM Capacity:           0
Controller ID:                      0
NVMe Version:                       1.3
Number of Namespaces:               128
Namespace 1 Size/Capacity:          400,088,457,216 [400 GB]
Namespace 1 Formatted LBA Size:     512
Namespace 1 IEEE EUI-64:            5cd2e4 56a7030600
Local Time is:                      Wed Sep  3 17:37:15 2025 KST
Firmware Updates (0x18):            4 Slots, no Reset required
Optional Admin Commands (0x001e):   Format Frmw_DL NS_Mngmt Self_Test
Optional NVM Commands (0x004e):     Wr_Unc DS_Mngmt Wr_Zero Timestmp
Log Page Attributes (0x1e):         Cmd_Eff_Lg Ext_Get_Lg Telmtry_Lg Pers_Ev_Lg
Maximum Data Transfer Size:         32 Pages
Warning  Comp. Temp. Threshold:     70 Celsius
Critical Comp. Temp. Threshold:     80 Celsius
Namespace 1 Features (0x02):        NA_Fields

Supported Power States
St Op     Max   Active     Idle   RL RT WL WT  Ent_Lat  Ex_Lat
 0 +    13.00W       -        -    0  0  0  0        0       0
 1 +    11.00W       -        -    0  1  0  1        0       0
 2 +     9.00W       -        -    0  2  0  2        0       0

Supported LBA Sizes (NSID 0x1)
Id Fmt  Data  Metadt  Rel_Perf
 0 +     512       0         2
 1 -     512       8         2
 2 -    4096       0         2
 3 -    4096       8         2
 4 -    4096      64         2

=== START OF SMART DATA SECTION ===
SMART overall-health self-assessment test result: PASSED

SMART/Health Information (NVMe Log 0x02)
Critical Warning:                   0x00
Temperature:                        27 Celsius
Available Spare:                    100%
Available Spare Threshold:          0%
Percentage Used:                    0%
Data Units Read:                    890,365 [455 GB]
Data Units Written:                 580,293 [297 GB]
Host Read Commands:                 41,794,450
Host Write Commands:                27,591,393
Controller Busy Time:               2
Power Cycles:                       6
Power On Hours:                     0
Unsafe Shutdowns:                   0
Media and Data Integrity Errors:    0
Error Information Log Entries:      0
Warning  Comp. Temperature Time:    0
Critical Comp. Temperature Time:    0

Error Information (NVMe Log 0x01, 16 of 256 entries)
No Errors Logged

Self-test Log (NVMe Log 0x06)
Self-test status: No self-test in progress
No Self-tests Logged

